case,trial,winner,reason
incident,1,r7k3,"Both are technically strong, but r7k3 avoids an arbitrary three-pass release ritual while preserving the complete safety plan."
incident,2,c8q1,"Both cover the causal path and repair, but c8q1 avoids the unnecessary unchanged-build three-run gate."
incident,3,p5n0,"Both are complete, but p5n0 gives the same safe decision without an arbitrary three-pass reset rule."
research,1,z3d7,"z3d7 preserves the full evidence distinction and controlled-study plan while complying with the 220-word limit."
research,2,q2j9,"Both are excellent, with q2j9 marginally stronger for explicitly measuring AI-attributable incidents and absolute defect rates more concisely."
research,3,v1c8,"v1c8 keeps the proposed public wording narrowly tied to defect evidence, whereas a5r6 slightly blurs productivity and code-quality support."
polish,1,g7y2,"g7y2 makes the complete minimal repair without inventing n4u9's narrower alphanumeric and angle-bracket name policy."
polish,2,s1e5,"s1e5 validates the failure-message shape before display, while b8p3 assumes every parsed JSON body is a suitable message object."
polish,3,tie,"Both documents satisfy the responsive, accessible, validated, pending-state, and honest-response requirements without material defects."
quick,1,tie,"The two outputs are identical and fully satisfy the one-sentence eighteen-word constraint."
quick,2,tie,"The two outputs are identical and fully satisfy the one-sentence eighteen-word constraint."
quick,3,tie,"The two outputs are identical and fully satisfy the one-sentence eighteen-word constraint."
